{
  "platform": "cursor",
  "displayName": "Cursor",
  "installType": "full",
  "folderStructure": {
    "root": ".cursor",
    "skillPath": "skills-cursor",
    "filename": "SKILL.md"
  },
  "skillNamePrefix": "dynos-work-",
  "defaultScope": "global",
  "frontmatter": {
    "name": "dynos-work",
    "description": "Task foundry for software engineering: discovery → spec → plan → execute → audit. Individual skills invoked as /dynos-work-start, /dynos-work-audit, etc."
  },
  "capabilities": {
    "parallel_subagents": false,
    "lifecycle_hooks": false,
    "transcript_parsing": false,
    "per_agent_model": false,
    "structured_questions": false,
    "env_injection": false
  },
  "skillOrWorkflow": "Skill"
}
